{
  "gate_id": "G13",
  "status": "passed",
  "evaluated_at": "2026-08-27T00:59:32.6586836+00:00",
  "role": "validator",
  "acceptance": "Filesystem/search/Git/shell/PDF behavior and security tests pass.",
  "evidence": [
    ".forge-codex/state/validator-reports/P13-G13.json",
    ".forge-codex/state/commands/20260827T001102639Z-955cd3e3.json",
    ".forge-codex/state/commands/20260827T001102639Z-955cd3e3.stdout.txt",
    ".forge-codex/state/commands/20260827T001102639Z-955cd3e3.stderr.txt",
    ".forge-codex/state/commands/20260827T004850613Z-0bbd4db1.json",
    ".forge-codex/state/commands/20260827T004850613Z-0bbd4db1.stdout.txt",
    ".forge-codex/state/commands/20260827T004850613Z-0bbd4db1.stderr.txt",
    "out/build/windows-msvc-x64/Testing/Temporary/LastTest.log",
    "scripts/validation/Test-G13NativeTools.ps1",
    "scripts/validation/Test-G06WindowsInfrastructure.ps1",
    "CMakeLists.txt",
    "include/ForgeConductor/Contracts/IFileSystemServices.h",
    "include/ForgeConductor/Contracts/INativeToolServices.h",
    "include/ForgeConductor/Contracts/IPathGlobService.h",
    "include/ForgeConductor/Domain/FileSystemModels.h",
    "include/ForgeConductor/Domain/PdfModels.h",
    "include/ForgeConductor/Infrastructure/Windows/WindowsWorkspaceAuthority.h",
    "include/ForgeConductor/NativeTools/Windows/WindowsFileSystem.h",
    "include/ForgeConductor/NativeTools/Windows/WindowsGitService.h",
    "include/ForgeConductor/NativeTools/Windows/WindowsPathGlobService.h",
    "include/ForgeConductor/NativeTools/Windows/WindowsPdfService.h",
    "include/ForgeConductor/NativeTools/Windows/WindowsShellService.h",
    "include/ForgeConductor/NativeTools/Windows/WindowsTextSearchService.h",
    "src/Infrastructure/Windows/Detail/DiagnosticRotationPublishObserver.h",
    "src/Infrastructure/Windows/WindowsDiagnosticSink.cpp",
    "src/NativeTools/Windows/NativeFileOperations.cpp",
    "src/NativeTools/Windows/WindowsFileSystem.cpp",
    "src/NativeTools/Windows/WindowsGitService.cpp",
    "src/NativeTools/Windows/WindowsPathGlobService.cpp",
    "src/NativeTools/Windows/WindowsPdfService.cpp",
    "src/NativeTools/Windows/WindowsShellService.cpp",
    "src/NativeTools/Windows/WindowsTextSearchService.cpp",
    "tests/Infrastructure/WindowsDiagnosticSinkTests.cpp",
    "tests/NativeTools/WindowsFileSystemSearchTests.cpp",
    "tests/NativeTools/WindowsGitShellIntegrationTests.cpp",
    "tests/NativeTools/WindowsGitShellTests.cpp",
    "tests/NativeTools/WindowsPdfServiceTests.cpp",
    "tests/NativeTools/WindowsWorkspaceAuthorityTests.cpp",
    ".forge-codex/state/decisions/OWNER-002-alpha-release-qualification-scope.md",
    ".forge-codex/state/decisions/P13-001-bounded-native-tool-boundaries.md",
    ".forge-codex/state/decisions/P13-002-handle-aware-filesystem-search-and-glob.md",
    ".forge-codex/state/decisions/P13-003-exact-git-and-powershell-process-adapters.md",
    ".forge-codex/state/decisions/P13-004-deterministic-native-pdf-writer.md",
    ".forge-codex/state/decisions/P13-005-native-services-to-mcp-parity-boundary.md",
    ".forge-codex/state/decisions/P13-006-g13-regression-and-alpha-qualification.md"
  ],
  "failures": []
}
