{
  "gate_id": "G03",
  "status": "passed",
  "evaluated_at": "2026-08-25T10:17:41.6094546+00:00",
  "role": "validator",
  "acceptance": "Task contract/profile/public API/module/dependency decisions pass.",
  "evidence": [
    ".forge-codex/state/validator-reports/P03.json",
    ".forge-codex/state/commands/20260825T101058942Z-87ab4100.json",
    ".forge-codex/state/commands/20260825T101202492Z-2385e578.json",
    ".forge-codex/state/commands/20260825T101439602Z-1c8e07c2.json",
    ".forge-codex/state/commands/20260825T101457086Z-0b3a122b.json",
    ".forge-codex/state/commands/20260825T093342537Z-cf79732f.json",
    ".forge-codex/state/commands/20260825T093451916Z-b6fcf5ca.json",
    ".forge-codex/state/commands/20260825T093633245Z-35b54512.json",
    ".forge-codex/state/commands/20260825T093648999Z-82d9497b.json",
    ".forge-codex/state/commands/20260825T093719995Z-2f4e92bd.json",
    ".forge-codex/state/commands/20260825T093810695Z-2db748d9.json",
    ".forge-codex/state/baseline/p03-forsetti-source-lock.json",
    ".forge-codex/state/baseline/p03-forsetti-public-api.json",
    ".forge-codex/state/baseline/p03-upstream-advisory/contract.json",
    ".forge-codex/state/baseline/p03-upstream-advisory/project-context.json",
    ".forge-codex/state/baseline/p03-upstream-advisory/edition-profile.json",
    ".forge-codex/state/baseline/p03-upstream-advisory/manifest.json",
    "src/ForgeConductor.ForsettiModule/Resources/ForsettiManifests/ForgeConductorAppModule.json",
    "manifests/ForsettiManifests/forge-conductor.json",
    "THIRD-PARTY-NOTICES.md",
    ".forge-codex/state/decisions/P03-001-governance-profile-and-source-pins.md",
    ".forge-codex/state/decisions/P03-002-sealed-forsetti-consumption.md",
    ".forge-codex/state/decisions/P03-003-single-app-module-and-process-topology.md",
    ".forge-codex/state/decisions/P03-004-dependency-direction-and-composition-roots.md",
    ".forge-codex/state/decisions/P03-005-manifest-capabilities-and-runtime-requirements.md",
    ".forge-codex/state/decisions/P03-006-host-activation-service-and-ui-composition.md",
    ".forge-codex/state/decisions/P03-007-data-isolation-and-cross-process-ownership.md",
    ".forge-codex/state/decisions/P03-008-boundary-lifetimes-errors-and-bounds.md",
    ".forge-codex/state/decisions/P03-009-licensing-provenance-and-attribution.md",
    ".forge-codex/state/decisions/P03-010-g03-validation-and-upstream-defects.md"
  ],
  "failures": []
}
