{
  "gate_id": "G14",
  "status": "passed",
  "evaluated_at": "2026-08-27T11:57:44.3751007+00:00",
  "role": "validator",
  "acceptance": "Initialize and exact 53-tool semantic snapshot pass in primary/fallback roles.",
  "evidence": [
    ".forge-codex/state/validator-reports/P14-G14.json",
    ".forge-codex/state/commands/20260827T112918356Z-a8f5616a.json",
    ".forge-codex/state/commands/20260827T112918356Z-a8f5616a.stdout.txt",
    ".forge-codex/state/commands/20260827T112918356Z-a8f5616a.stderr.txt",
    ".forge-codex/state/evidence/P14/dynamic-multi-project-workspace-authority-checkpoint.json",
    ".forge-codex/state/decisions/P14-009-dynamic-project-authority-and-private-execution-scopes.md",
    ".forge-codex/instructions/plans/mcp-tool-parity.json",
    ".forge-codex/instructions/plans/feature-parity-matrix.json",
    ".forge-codex/instructions/plans/feature-parity-matrix.tsv",
    ".forge-codex/state/evidence-index.json",
    "out/build/windows-msvc-x64/Testing/Temporary/LastTest.log",
    "CMakeLists.txt",
    "include/ForgeConductor/Contracts/INativeToolServices.h",
    "include/ForgeConductor/Infrastructure/Windows/WindowsProjectWorkspaceAuthority.h",
    "src/Application/LegacyContextContinuityService.cpp",
    "src/Hosts/Cli/McpServeCompositionRoot.cpp",
    "src/Infrastructure/Windows/Detail/WindowsPathResolver.cpp",
    "src/Infrastructure/Windows/WindowsProjectWorkspaceAuthority.cpp",
    "src/Mcp/McpToolPackAdapter.cpp",
    "src/NativeTools/Windows/NativeToolValidation.h",
    "src/NativeTools/Windows/WindowsGitService.cpp",
    "src/NativeTools/Windows/WindowsShellService.cpp",
    "tests/Application/LegacyContextContinuityServiceTests.cpp",
    "tests/Infrastructure/StorageWindowsTests.cpp",
    "tests/Infrastructure/WindowsProjectWorkspaceAuthorityTests.cpp",
    "tests/Mcp/McpServeProcessSnapshotTests.cpp",
    "tests/Mcp/McpToolPackAdapterTests.cpp",
    "tests/Mcp/McpToolContractMatrixTests.cpp",
    "tests/NativeTools/WindowsGitShellTests.cpp",
    "tests/NativeTools/WindowsGitShellIntegrationTests.cpp",
    ".forge-codex/state/decisions/OWNER-002-alpha-release-qualification-scope.md",
    ".forge-codex/state/decisions/P14-001-mcp-catalog-codec-and-wire-precedence.md",
    ".forge-codex/state/decisions/P14-002-bounded-mcp-server-and-stdio-lifetimes.md",
    ".forge-codex/state/decisions/P14-003-authority-routed-tool-packs-and-continuity-guard.md",
    ".forge-codex/state/decisions/P14-004-client-scoped-context-recovery-and-authority.md",
    ".forge-codex/state/evidence/P14/mcp-server-stdio-checkpoint.json",
    ".forge-codex/state/evidence/P14/mcp-routing-toolpack-continuity-checkpoint.json",
    ".forge-codex/state/evidence/P14/client-workspace-context-recovery-checkpoint.json",
    ".forge-codex/state/commands/20260827T035549337Z-63fdd812.json",
    ".forge-codex/state/commands/20260827T035619648Z-47888d8b.json",
    ".forge-codex/state/commands/20260827T044125881Z-66ec7eb1.json",
    ".forge-codex/state/commands/20260827T044230392Z-8a391847.json",
    ".forge-codex/state/decisions/P14-005-authoritative-mcp-runtime-persistence.md",
    ".forge-codex/state/commands/20260827T051933035Z-a5353193.json",
    ".forge-codex/state/commands/20260827T052009026Z-5792fdf6.json",
    ".forge-codex/state/commands/20260827T052352847Z-80423366.json",
    ".forge-codex/state/evidence/P14/authoritative-mcp-runtime-persistence-checkpoint.json",
    ".forge-codex/state/decisions/P14-006-client-presence-and-status-parity.md",
    ".forge-codex/state/commands/20260827T054341785Z-c98598c5.json",
    ".forge-codex/state/commands/20260827T054525831Z-137deddf.json",
    ".forge-codex/state/commands/20260827T054540604Z-35e385f2.json",
    ".forge-codex/state/commands/20260827T060844888Z-a5eff22a.json",
    ".forge-codex/state/commands/20260827T063848180Z-a4c846e0.json",
    ".forge-codex/state/commands/20260827T063940982Z-3484df2a.json",
    ".forge-codex/state/commands/20260827T065204115Z-d60b16db.json",
    ".forge-codex/state/commands/20260827T065228507Z-f394a754.json",
    ".forge-codex/state/commands/20260827T065734188Z-9ae2dbbd.json",
    ".forge-codex/state/commands/20260827T065835912Z-69d028a1.json",
    ".forge-codex/state/commands/20260827T071247018Z-8c3b0969.json",
    ".forge-codex/state/commands/20260827T071307202Z-a122e8a1.json",
    ".forge-codex/state/commands/20260827T071329153Z-7149020f.json",
    ".forge-codex/state/commands/20260827T071846497Z-044a8ed6.json",
    ".forge-codex/state/commands/20260827T071929036Z-b5999a73.json",
    ".forge-codex/state/commands/20260827T072025739Z-5d369ac7.json",
    ".forge-codex/state/evidence/P14/mcp-presence-continuity-status-checkpoint.json",
    ".forge-codex/state/decisions/P14-007-alpha-stdio-persistence-ownership.md",
    ".forge-codex/state/commands/20260827T075424142Z-d322862c.json",
    ".forge-codex/state/commands/20260827T080544923Z-8ead2fbf.json",
    ".forge-codex/state/commands/20260827T080627818Z-6a419ea5.json",
    ".forge-codex/state/commands/20260827T080837982Z-d54ec62a.json",
    ".forge-codex/state/commands/20260827T081344523Z-ed83f6be.json",
    ".forge-codex/state/evidence/P14/stdio-serve-primary-fallback-snapshot-checkpoint.json",
    ".forge-codex/state/commands/20260827T085700851Z-c02f2cee.json",
    ".forge-codex/state/commands/20260827T090149461Z-c5cbe046.json",
    ".forge-codex/state/evidence/P14/shared-home-role-concurrency-checkpoint.json",
    ".forge-codex/state/decisions/P14-008-source-compatible-mcp-semantics-and-windows-extensions.md",
    ".forge-codex/state/commands/20260827T100751448Z-8deaa7ec.json",
    ".forge-codex/state/commands/20260827T100908176Z-036a09a7.json",
    ".forge-codex/state/commands/20260827T101001127Z-bac9cd57.json",
    ".forge-codex/state/evidence/P14/mcp-tool-contract-matrix-checkpoint.json",
    ".forge-codex/state/commands/20260827T101427449Z-191d5151.json"
  ],
  "failures": []
}
