{
  "gate_id": "G08",
  "status": "passed",
  "evaluated_at": "2026-08-26T11:08:49.9104443+00:00",
  "role": "validator",
  "acceptance": "All twelve tools, isolation, reset, import/export, bounds, redaction pass.",
  "evidence": [
    ".forge-codex/state/commands/20260826T100125998Z-d2a6f34b.json",
    ".forge-codex/state/commands/20260826T105459614Z-e5c5a118.json",
    ".forge-codex/state/commands/20260826T110053212Z-c97ad189.json",
    ".forge-codex/state/validator-reports/P08.json",
    ".forge-codex/state/decisions/P08-001-project-identity-and-registry-authority.md",
    ".forge-codex/state/decisions/P08-002-project-repository-cache-and-operation-ownership.md",
    ".forge-codex/state/decisions/P08-003-project-memory-observable-semantics-and-artifacts.md",
    "scripts/validation/Test-G08ProjectMemory.ps1",
    "CMakeLists.txt",
    "include/ForgeConductor/Domain/ProjectMemoryModels.h",
    "include/ForgeConductor/Contracts/IProjectMemoryArtifactStore.h",
    "include/ForgeConductor/Contracts/IProjectMemoryService.h",
    "include/ForgeConductor/Application/ProjectMemoryRepositoryCache.h",
    "include/ForgeConductor/Application/ProjectMemoryService.h",
    "src/Domain/ProjectMemoryModels.cpp",
    "src/Application/ProjectMemoryRepositoryCache.cpp",
    "src/Application/ProjectMemoryService.cpp",
    "src/Persistence/Windows/WindowsProjectMemoryArtifactStore.cpp",
    "src/Persistence/Windows/WindowsProjectMemoryRepository.cpp",
    "src/Persistence/Windows/WindowsProjectMemoryRepositoryOpener.cpp",
    "src/Persistence/Windows/WindowsProjectRegistryRepository.cpp",
    "tests/ProjectMemory/ProjectMemoryApplicationTests.cpp",
    "tests/ProjectMemory/ProjectMemoryArtifactWindowsTests.cpp",
    "tests/ProjectMemory/ProjectMemoryCacheTests.cpp",
    "tests/ProjectMemory/ProjectMemoryRepositoryWindowsTests.cpp",
    "tests/ProjectMemory/ProjectRegistryWindowsTests.cpp",
    "tests/ProjectMemory/Fixtures/macos-0.9.0-project-memory-export-v1.json"
  ],
  "failures": []
}
