{
  "gate_id": "G16",
  "status": "passed",
  "evaluated_at": "2026-08-30T21:05:39.7811817+00:00",
  "role": "validator",
  "acceptance": "Single ownership, authenticated IPC, startup, restart, and shutdown pass.",
  "evidence": [
    ".forge-codex/state/validator-reports/P16-G16.json",
    ".forge-codex/state/commands/20260830T205625942Z-6c5ee702.json",
    ".forge-codex/state/commands/20260830T205625942Z-6c5ee702.stdout.txt",
    ".forge-codex/state/commands/20260830T205625942Z-6c5ee702.stderr.txt",
    ".forge-codex/state/evidence/P16/g16-validation-summary.json",
    ".forge-codex/state/evidence/P16/g16-attempt.json",
    ".forge-codex/state/evidence/P16/g16-LastTest.log",
    ".forge-codex/state/commands/20260830T203522380Z-255a4469.json",
    ".forge-codex/state/commands/20260830T203522380Z-255a4469.stdout.txt",
    ".forge-codex/state/commands/20260830T203522380Z-255a4469.stderr.txt",
    ".forge-codex/state/evidence/P16/g16-attempt-history/6d7a192e9a2042759c6e857a4d0e440e/attempt.json",
    ".forge-codex/state/evidence/P16/g16-attempt-history/6d7a192e9a2042759c6e857a4d0e440e/rollover.json",
    ".forge-codex/state/decisions/OWNER-002-alpha-release-qualification-scope.md",
    ".forge-codex/state/decisions/P16-001-single-owner-manager-and-current-user-control-plane.md",
    ".forge-codex/state/decisions/P16-037-production-manager-composition-boundaries.md",
    ".forge-codex/state/decisions/P16-038-hash-bound-g16-qualification-and-independent-finalization.md",
    ".forge-codex/state/decisions/P16-039-windows-powershell-evidence-runner-compatibility.md",
    ".forge-codex/instructions/plans/feature-parity-matrix.json",
    ".forge-codex/instructions/plans/feature-parity-matrix.tsv",
    ".forge-codex/state/evidence-index.json",
    "scripts/validation/Test-G16ManagerIpcDashboard.ps1",
    "src/Hosts/Manager/ManagerCompositionRoot.cpp",
    "src/Hosts/Manager/WindowsManagerRuntime.cpp",
    "tests/Manager/WindowsManagerCompositionLifecycleTests.cpp"
  ],
  "failures": []
}
