{
  "gate_id": "G07",
  "status": "passed",
  "evaluated_at": "2026-08-26T06:58:47.1681526+00:00",
  "role": "validator",
  "acceptance": "Winsqlite3 migration/integrity/concurrency/backup tests pass.",
  "evidence": [
    ".forge-codex/state/commands/20260826T064840848Z-5afa64c1.json",
    ".forge-codex/state/commands/20260826T064916442Z-ba65f2be.json",
    ".forge-codex/state/commands/20260826T065117059Z-844c7919.json",
    ".forge-codex/state/decisions/P07-001-winsqlite-persistence-boundary-and-ownership.md",
    ".forge-codex/state/decisions/P07-002-source-compatible-schema-lineage.md",
    ".forge-codex/state/decisions/P07-003-anchored-database-namespace-and-online-backups.md",
    ".forge-codex/state/validator-reports/P07.json",
    "CMakeLists.txt",
    "include/ForgeConductor/Persistence/Windows/DatabaseModels.h",
    "include/ForgeConductor/Persistence/Windows/PersistenceWindows.h",
    "include/ForgeConductor/Persistence/Windows/WindowsCentralDatabase.h",
    "include/ForgeConductor/Persistence/Windows/WindowsProjectDatabase.h",
    "scripts/validation/Test-G07DatabaseMigrations.ps1",
    "src/Persistence/Windows/DatabaseBackupCoordinator.cpp",
    "src/Persistence/Windows/DatabaseBackupCoordinator.h",
    "src/Persistence/Windows/DatabaseQuarantine.cpp",
    "src/Persistence/Windows/DatabaseQuarantine.h",
    "src/Persistence/Windows/Detail/AnchoredSqliteVfs.cpp",
    "src/Persistence/Windows/Detail/AnchoredSqliteVfs.h",
    "src/Persistence/Windows/Detail/DatabaseNamespaceLease.cpp",
    "src/Persistence/Windows/Detail/DatabaseNamespaceLease.h",
    "src/Persistence/Windows/Detail/WindowsDatabaseStore.cpp",
    "src/Persistence/Windows/Detail/WindowsDatabaseStore.h",
    "src/Persistence/Windows/Detail/WinsqliteBackup.cpp",
    "src/Persistence/Windows/Detail/WinsqliteBackup.h",
    "src/Persistence/Windows/Detail/WinsqliteConnection.cpp",
    "src/Persistence/Windows/Detail/WinsqliteConnection.h",
    "src/Persistence/Windows/Detail/WinsqliteError.cpp",
    "src/Persistence/Windows/Detail/WinsqliteError.h",
    "src/Persistence/Windows/Detail/WinsqliteOperationGuard.cpp",
    "src/Persistence/Windows/Detail/WinsqliteOperationGuard.h",
    "src/Persistence/Windows/Detail/WinsqliteStatement.cpp",
    "src/Persistence/Windows/Detail/WinsqliteStatement.h",
    "src/Persistence/Windows/Detail/WinsqliteTransaction.cpp",
    "src/Persistence/Windows/Detail/WinsqliteTransaction.h",
    "src/Persistence/Windows/Migrations/CentralMigrations.cpp",
    "src/Persistence/Windows/Migrations/CentralMigrations.h",
    "src/Persistence/Windows/Migrations/MigrationManifest.h",
    "src/Persistence/Windows/Migrations/ProjectMigrations.cpp",
    "src/Persistence/Windows/Migrations/ProjectMigrations.h",
    "src/Persistence/Windows/Migrations/SchemaMigrator.cpp",
    "src/Persistence/Windows/Migrations/SchemaMigrator.h",
    "src/Persistence/Windows/WindowsCentralDatabase.cpp",
    "src/Persistence/Windows/WindowsProjectDatabase.cpp",
    "tests/Architecture/P07HeaderSelfContainmentMain.cpp",
    "tests/Persistence/BackupIntegrityTests.cpp",
    "tests/Persistence/CentralMigrationTests.cpp",
    "tests/Persistence/DatabaseAuthorityTests.cpp",
    "tests/Persistence/DatabaseConcurrencyTests.cpp",
    "tests/Persistence/DatabaseStoreSerializationTests.cpp",
    "tests/Persistence/Fixtures/central-v3-minimal.sql",
    "tests/Persistence/Fixtures/central-v3.sql",
    "tests/Persistence/Fixtures/central-v5.sql",
    "tests/Persistence/Fixtures/project-v1.sql",
    "tests/Persistence/Fixtures/README.md",
    "tests/Persistence/IntegrityRecoveryTests.cpp",
    "tests/Persistence/PersistenceProcessFixture.cpp",
    "tests/Persistence/PersistenceTestMain.cpp",
    "tests/Persistence/PersistenceTestSupport.h",
    "tests/Persistence/ProjectMigrationTests.cpp",
    "tests/Persistence/WinsqliteKernelTests.cpp"
  ],
  "failures": []
}
